"datum_geschaeft_eingang","geschaeftsnummer","grg_nummer","geschaftstitel","geschaftsart","kennung","sachbegriff_grgeko_1","sachbegriff_grgeko_2","status","departement"
2024-05-22,"2024/WA 1/1","1","Amtsgelübde der neugewählten Mitglieder des Grossen Rates","Wahlgeschäft","WA","17.1 Grosser Rat",,"abgeschlossen","Grosser Rat"
2024-05-22,"2024/WA 2/2","2","Amtsgelübde von Regierungsrätin Denise Neuweiler","Wahlgeschäft","WA","17.2 Regierungsrat",,"abgeschlossen","Grosser Rat"
2024-05-22,"2024/WA 3/3","3","Amtsgelübde von Regierungsrätin Sonja Wiesmann Schätzle","Wahlgeschäft","WA","17.2 Regierungsrat",,"abgeschlossen","Grosser Rat"
2024-05-22,"2024/WA 4/4","4","Amtsgelübde von Sarah Nobs, Ersatzmitglied Obergericht","Wahlgeschäft","WA","17.3 Richterliche Behörden, Anwaltswesen",,"abgeschlossen","Grosser Rat"
2024-05-22,"2024/WA 5/5","5","Amtsgelübde von Fabienne Hanselmann, Ersatzmitglied Verwaltungsgericht","Wahlgeschäft","WA","17.3 Richterliche Behörden, Anwaltswesen",,"abgeschlossen","Grosser Rat"
2024-05-22,"2024/WA 6/6","6","Amtsgelübde von Hanna Trippel, Ersatzmitglied Verwaltungsgericht","Wahlgeschäft","WA","17.3 Richterliche Behörden, Anwaltswesen",,"abgeschlossen","Grosser Rat"
2024-05-22,"2024/WA 7/7","7","Wahl des Präsidiums des Grossen Rates für das Amtsjahr 2024/2025","Wahlgeschäft","WA","17.1 Grosser Rat",,"abgeschlossen","Grosser Rat"
2024-05-22,"2024/WA 8/8","8","Wahl des Vizepräsidiums des Grossen Rates für das Amtsjahr 2024/2025","Wahlgeschäft","WA","17.1 Grosser Rat",,"abgeschlossen","Grosser Rat"
2024-05-22,"2024/WA 9/9","9","Wahl des Präsidiums und des Vizepräsidiums des Regierungsrates für das Amtsjahr 2024/2025","Wahlgeschäft","WA","17.2 Regierungsrat",,"abgeschlossen","Grosser Rat"
2024-05-22,"2024/WA 10/10","10","Wahl der Mitglieder des Ratssekretariates, Stimmenzählenden und Beisitzenden für die Amtsdauer 2024-2028","Wahlgeschäft","WA","17.1 Grosser Rat",,"abgeschlossen","Grosser Rat"
2024-05-22,"2024/WA 11/11","11","Wahl der Mitglieder und des Präsidiums der Geschäftsprüfungs- und Finanzkommission für die Amtsdauer 2024-2028","Wahlgeschäft","WA","17.1 Grosser Rat",,"abgeschlossen","Grosser Rat"
2024-05-22,"2024/WA 12/12","12","Wahl der Mitglieder und des Präsidiums der Justizkommission für die Amtsdauer 2024-2028","Wahlgeschäft","WA","17.1 Grosser Rat",,"abgeschlossen","Grosser Rat"
2024-05-22,"2024/WA 13/13","13","Wahl der Mitglieder und des Präsidiums der Raumplanungskommission für die Amtsdauer 2024-2028","Wahlgeschäft","WA","17.1 Grosser Rat",,"abgeschlossen","Grosser Rat"
2024-05-22,"2024/WA 14/14","14","Wahl der Mitglieder und des Präsidiums der Kommission für Klima, Energie und Umwelt für die Amtsdauer 2024-2028","Wahlgeschäft","WA","17.1 Grosser Rat",,"abgeschlossen","Grosser Rat"
2024-05-22,"2024/WA 15/15","15","Wahl der Mitglieder und des Präsidiums der Gesetzgebungs- und Redaktionskommission für die Amtsdauer 2024-2028","Wahlgeschäft","WA","17.1 Grosser Rat",,"abgeschlossen","Grosser Rat"
2024-05-22,"2024/WA 16/16","16","Genehmigung der Wahl der Mitglieder des Grossen Rates vom 7. April 2024","Wahlgeschäft","WA","17.1 Grosser Rat",,"abgeschlossen","Grosser Rat"
2024-05-22,"2024/GE 1/17","17","Ruhetagsgesetz (RTG)","Gesetz","GE","",,"pendent","Departement für Inneres und Volkswirtschaft"
2024-05-22,"2024/BS 1/18","18","Beschluss des Grossen Rates über einen Nachtragskredit 2024","Beschluss","BS","",,"abgeschlossen","Departement für Finanzen und Soziales"
2024-06-05,"2024/GE 2/19","19","Änderung des Planungs- und Baugesetzes (PBG)","Gesetz","GE","70.2 Baugesetz; Planungen Hoch- und Tiefbau, Baulinien",,"abgeschlossen","Departement für Bau und Umwelt"
2024-06-05,"2024/GE 3/20","20","Änderung des Gesetzes über die Zivil- und Strafrechtspflege (ZSRG), der Verordnung des Grossen Rates über die Besoldung des Staatspersonals (BesVO), des Einführungsgesetzes zum Schweizerischen Zivilgesetzbuch (EG ZGB) und des Verantwortlichkeitsgesetzes (VerantwG)","Gesetz","GE","27.0 Zivilrechtspflege",,"abgeschlossen","Departement für Justiz und Sicherheit"
2024-06-05,"2024/BS 2/21","21","Beschluss des Grossen Rates über den Nachtragskredit zur Erhöhung des Globalbudgets 2024 der Steuerverwaltung","Beschluss","BS","61.2 Budget, Finanzplan, Staatsrechnung",,"abgeschlossen","Departement für Finanzen und Soziales"
2025-07-02,"2024/FR 1/22","22","Fragestunde vom 03.07.2024","Fragestunde","FR","10.1 Kantonsverfassung und Staatsverträge",,"abgeschlossen",""
2024-06-05,"2024/EA 1/23","23","Einfache Anfrage von Jost Rüegg vom 5. Juni 2024 \"Bewilligungspraxis adaptiver 5G-Mobilfunkantennen im Thurgau\"","Einfache Anfrage","EA","70.2 Baugesetz; Planungen Hoch- und Tiefbau, Baulinien",,"abgeschlossen","Departement für Bau und Umwelt"
2024-06-05,"2024/EA 2/24","24","Einfache Anfrage von Reto Ammann vom 5. Juni 2024 \"Vom Erziehungsdepartement zum Bildungsdepartement\"","Einfache Anfrage","EA","41.4 Berufliches Bildungswesen",,"abgeschlossen","Departement für Erziehung und Kultur"
2024-06-05,"2024/EA 3/25","25","Einfache Anfrage von Andreas Opprecht, Maja Brühlmann Zwahlen vom 5. Juni 2024 \"Bald keine Poststellen mehr im Thurgau?\"","Einfache Anfrage","EA","74.6 PTT, Radio, Fernsehen etc.",,"abgeschlossen","Departement für Inneres und Volkswirtschaft"
2024-06-05,"2024/IN 1/26","26","Interpellation von Kenny Greber, Turi Schallenberg vom 5. Juni 2024 \"Koordinierter Umgang mit Staatsverweigerern und Reichsbürgern\"","Interpellation","IN","55.1 Polizeikorps / interkantonale Zusammenarbeit",,"abgeschlossen","Departement für Justiz und Sicherheit"
2024-06-05,"2024/MO 1/27","27","Motion von Reto Ammann, Stephan Tobler, Daniel Eugster, Alexander Sigg vom 5. Juni 2024 \"Warme Progression analog der kalten Progression gesetzlich regeln. Anpassung der Steuertabellen an den Nominallohnindex, entlastet die Wirtschaft und die Haushalte\"","Motion","MO","64.1 Staats- und Gemeindesteuern, allgemeine Organisation",,"abgeschlossen","Departement für Finanzen und Soziales"
2024-06-05,"2024/MO 2/28","28","Motion von Oliver Martin, Franz Eugster, Elisabeth Rickenbach, Brigitta Engeli vom 5. Juni 2024 \"Zum Schutz und Verständlichkeit der deutschen Sprache\"","Motion","MO","13.1 Gebiet, Organisation, Reglemente, Verwaltung",,"pendent","Departement für Erziehung und Kultur"
2024-06-05,"2024/MO 3/29","29","Motion von Beda Stähelin, Hermann Lei, Michèle Strähl vom 5. Juni 2024 \"Gerichtskostenreduktion bei Begründungsverzicht\"","Motion","MO","",,"abgeschlossen","Departement für Justiz und Sicherheit"
2024-06-19,"2024/BS 3/30","30","Botschaft betreffend Beitritt des Kantons Thurgau zur Interkantonalen Vereinbarung vom 22. Mai 2024 über die BVG- und Stiftungsaufsicht der Kantone Zürich, Glarus, Schaffhausen, Appenzell Ausserrhoden, Appenzell Innerrhoden, St. Gallen, Graubünden, Thurgau und Tessin (IVBSA)","Beschluss","BS","10.1 Kantonsverfassung und Staatsverträge",,"abgeschlossen","Departement für Bau und Umwelt"
2024-06-19,"2024/EA 4/31","31","Einfache Anfrage von Heinz Keller, Martina Pfiffner Müller, Ciril Schmidiger, Raffaella Strähl-D'Ambrosio vom 19. Juni 2024 \"Private Spitex-Anbieter erwirtschaften Dividenden auf Kosten von Kanton und Gemeinden\"","Einfache Anfrage","EA","83.2 Kranken- und Unfallversicherung, Vereinbarungen",,"abgeschlossen","Departement für Finanzen und Soziales"
2024-06-19,"2024/EA 5/32","32","Einfache Anfrage von Oliver Martin, Marcel Wittwer, Beat Stump vom 19. Juni 2024 \"Überprüfung der ausserordentlichen Regelung des Ruhegehalts für den Regierungsrat\"","Einfache Anfrage","EA","17.7 Staatspersonal: einzelne Personalentscheide",,"abgeschlossen","Departement für Finanzen und Soziales"
2024-06-19,"2024/MO 4/33","33","Motion von Hermann Lei, Franz Eugster, Marcel Wittwer, Aline Indergand, Oliver Martin vom 19. Juni 2024 \"Islamschulen an der Volksschule?\"","Motion","MO","",,"abgeschlossen","Departement für Erziehung und Kultur"
2024-06-19,"2024/IN 2/34","34","Interpellation von Aline Indergand, Hermann Lei, Franz Eugster, Andreas Opprecht vom 19. Juni 2024 \"kriminelle Clan-Strukturen im Kanton Thurgau\"","Interpellation","IN","31.1 StGB, EG/StGB, Verwaltungsstrafrecht",,"abgeschlossen","Departement für Justiz und Sicherheit"
2025-07-02,"2024/WE 1/35","35","Regierungsrichtlinien Thurgau 2024-2028 (RRL TG 2024-2028)","Weitere Geschäfte","WE","",,"abgeschlossen",""
2025-07-02,"2024/EA 6/36","36","Einfache Anfrage von Stefan Wolfer vom 3. Juli 2024 \"Amtsenthebungsverfahren von Einzelmitgliedern in Exekutivämtern von Behörden\"","Einfache Anfrage","EA","13.1 Gebiet, Organisation, Reglemente, Verwaltung",,"abgeschlossen","Departement für Inneres und Volkswirtschaft"
2025-07-02,"2024/EA 7/37","37","Einfache Anfrage von Michèle Strähl-Obrist vom 3. Juli 2024 \"Haben wir bald Thurgauer Polizisten ohne Schweizer Pass?\"","Einfache Anfrage","EA","51.1 Militärwesen, Beförderungen, Schiesswesen",,"abgeschlossen","Departement für Justiz und Sicherheit"
2025-07-02,"2024/EA 8/38","38","Einfache Anfrage von Sabina Peter Köstli, Barbara Dätwyler Weber vom 3. Juli 2024 \"Schutz und Prävention für Sexarbeitende im Thurgau\"","Einfache Anfrage","EA","55.1 Polizeikorps / interkantonale Zusammenarbeit",,"abgeschlossen","Departement für Justiz und Sicherheit"
2025-07-02,"2024/MO 5/39","39","Motion von Benno Schildknecht, Andreas Guhl, Josef Gemperle, Daniel Vetterli vom 3. Juli 2024 \"Anpassung Thurgauer Enteignungsgesetz TG EntG\"","Motion","MO","71.0 Enteignung",,"abgeschlossen","Departement für Bau und Umwelt"
2025-07-02,"2024/MO 6/40","40","Motion von Stefan Leuthold, Patrick Siegenthaler, Marina Bruggmann, Sandra Reinhart, Christian Mader, Robin Spiri vom 3. Juli 2024 \"Wahlen und Abstimmungen im öffentlichen Raum sichtbar machen\"","Motion","MO","",,"abgeschlossen","Departement für Bau und Umwelt"
2024-09-11,"2024/FR 2/41","41","Fragestunde vom 11.09.2024","Fragestunde","FR","10.1 Kantonsverfassung und Staatsverträge",,"abgeschlossen",""
2024-08-14,"2024/IN 3/42","42","Interpellation von Gabriel Macedo, Simon Wolfer, Thomas Niederberger, Roger Martin, René Walther, Anders Stokholm, Markus Birk vom 14. August 2024 \"Wirkung des kantonalen Finanzausgleichs\"","Interpellation","IN","61.3 Finanzausgleich",,"abgeschlossen","Departement für Finanzen und Soziales"
2024-08-14,"2024/EA 9/43","43","Einfache Anfrage von Hermann Lei vom 14. August 2024 \"Umsetzung Windenergie im Thurgau\"","Einfache Anfrage","EA","",,"abgeschlossen","Departement für Bau und Umwelt"
2024-08-14,"2024/EA 10/44","44","Einfache Anfrage von Gabriel Macedo vom 14. August 2024 \"Negative Auswirkungen einer nationalen Erbschaftssteuer auf Familienunternehmen im Kanton Thurgau\"","Einfache Anfrage","EA","",,"abgeschlossen","Departement für Finanzen und Soziales"
2024-08-14,"2024/IN 4/45","45","Interpellation von Reto Ammann, Marcel Preiss, Daniel Eugster, Nicole Zeitner, Attila Wohlrab, Felix Meier, Gabriel Walzthöny, Marcel Wittwer, Aline Indergand vom 14. August 2024 \"Handlungsalternativen im Investitionsbereich prüfen\"","Interpellation","IN","13.2 Rechnungswesen, Finanzen, Vermögen, Gebühren",,"abgeschlossen","Departement für Bau und Umwelt"
2024-08-28,"2024/WA 17/46","46","Ersatzwahl eines Mitglieds der Rekurskommission in Anwaltssachen für den Rest der Amtsdauer","Wahlgeschäft","WA","17.3 Richterliche Behörden, Anwaltswesen",,"abgeschlossen","Grosser Rat"
2024-08-28,"2024/EA 11/47","47","Einfache Anfrage von Gabriel Macedo, Andreas Opprecht vom 28. August 2024 \"Immer weniger Traulokale im Thurgau\"","Einfache Anfrage","EA","21.1 ZGB, EG/ZGB, Vormundschaft, Waisenämter",,"abgeschlossen","Departement für Justiz und Sicherheit"
2024-08-28,"2024/EA 12/48","48","Einfache Anfrage von Patrick Siegenthaler, Christoph Regli vom 28. August 2024 \"Soll künftig eine Mindestanzahl von Mitunterzeichnende erforderlich sein, um einen Vorstoss überweisen zu können?\"","Einfache Anfrage","EA","17.1 Grosser Rat",,"abgeschlossen",""
2024-08-28,"2024/MO 7/49","49","Motion von Judith Ricklin, Sabina Peter Köstli, Christian Mader, Manuela Fritschi, Stefan Leuthold, Traudi Schönegger, Cornelia Hauser vom 28. August 2024 \"Schaffung der Gewährung der Sonderschulung für Kinder und Jugendliche mit Behinderung gemäss Art. 62 Abs. 3 BV\"","Motion","MO","41.3 Sonderschulen, Privatschulen",,"pendent","Departement für Erziehung und Kultur"
2024-08-28,"2024/IN 5/50","50","Interpellation von Robin Spiri, Jacob Auer, Jost Rüegg, Oliver Martin, Marcel Wittwer, Dean Kradolfer vom 28. August 2024 \"Gewährleistung von Bargeldzahlungen in kantonalen Einrichtungen\"","Interpellation","IN","61.1 Finanzhaushalt, Finanzverwaltung und -kontrolle",,"pendent","Departement für Finanzen und Soziales"
2024-08-28,"2024/IN 6/51","51","Interpellation von Daniel Vetterli, Aline Indergand vom 28. August 2024 \"Handyverbot an Thurgauer Volksschulen\"","Interpellation","IN","41.0 Unterrichtswesen, Lehrerorganisation und -fortbildung",,"pendent","Departement für Erziehung und Kultur"
2024-08-28,"2024/IN 7/52","52","Interpellation von Marion Sontheim, Sandra Stadler, Ciril Schmidiger, Brigitta Engeli vom 28. August 2024 \"KulturLegi an den Musikschulen im Thurgau\"","Interpellation","IN","41.0 Unterrichtswesen, Lehrerorganisation und -fortbildung",,"pendent","Departement für Erziehung und Kultur"
2024-09-30,"2024/WA 18/53","53","Amtsgelübde von Kantonsrat Markus Bürgi","Wahlgeschäft","WA","17.1 Grosser Rat",,"abgeschlossen","Grosser Rat"
2024-10-23,"2024/EB 1/54","54","Kantonsbürgerrechtsgesuche","Einbürgerungsgesuch","EB","14.1 Bürgerrecht, Ein- und Ausbürgerungen, Taxen",,"abgeschlossen","Departement für Justiz und Sicherheit"
2024-09-11,"2024/EA 13/55","55","Einfache Anfrage von Gabriel Walzthöny vom 11. September 2024 \"Ausgewogene und sachliche Information bei Abstimmungen\"","Einfache Anfrage","EA","16.2 Abstimmungen",,"abgeschlossen","Staatskanzlei"
2024-09-11,"2024/EA 14/56","56","Einfache Anfrage von Brigitta Engeli-Sager vom 11. September 2024 \"Schule und Digitalität - Wohin steuert das Amt für Volksschule?\"","Einfache Anfrage","EA","41.0 Unterrichtswesen, Lehrerorganisation und -fortbildung",,"abgeschlossen","Departement für Erziehung und Kultur"
2024-09-11,"2024/EA 15/57","57","Einfache Anfrage von Mathias Dietz vom 11. September 2024 \"Mehr Sicherheit auf dem Schulweg - Leuchtwesten für die Thurgauer Schülerinnen und Schüler\"","Einfache Anfrage","EA","41.0 Unterrichtswesen, Lehrerorganisation und -fortbildung",,"abgeschlossen","Departement für Erziehung und Kultur"
2024-09-11,"2024/EA 16/58","58","Einfache Anfrage von Ruedi Zbinden, Heinz Keller, Raffaella Strähl-D'Ambrosio, Claude Brunner vom 11. September 2024 \"RRB 582 vom 27. August 2024 Ausbildungskapazitäten gemäss TG KVG und Bundesgesetz über die Förderung der Ausbildung im Bereich der Pflege\"","Einfache Anfrage","EA","83.2 Kranken- und Unfallversicherung, Vereinbarungen",,"abgeschlossen","Departement für Finanzen und Soziales"
2024-09-11,"2024/MO 8/59","59","Motion von Kenny Greber, Turi Schallenberg, Cornelia Hauser, Ulrich Graf, Corinna Pasche-Strasser, Mathias Dietz, Celina Hug, Cornelia Hasler-Roost, Robin Spiri vom 11. September 2024 \"Vermögensfreibetrag in der Sozialhilfe\"","Motion","MO","85.0 Fürsorge, Massnahmen, Kinderheime, Heimaufsicht",,"abgeschlossen","Departement für Finanzen und Soziales"
2024-09-11,"2024/MO 9/60","60","Motion von Elisabeth Rickenbach, Franz Eugster, Judith Ricklin, Barbara Dätwyler Weber, Nicole Zeitner, Brigitta Engeli-Sager, Lukas Madörin vom 11. September 2024 \"Verkaufsverbot von Einweg E-Zigaretten\"","Motion","MO","81.2 Heilmittel, Betäubungsmittel, Suchtprobleme",,"pendent","Departement für Finanzen und Soziales"
2024-09-11,"2024/PI 1/61","61","Parlamentarische Initiative von Stephan Tobler vom 11. September 2024 \"Gesetz über das Stimm- und Wahlrecht (StWG) vom 12. Februar 2014 (Stand 1. August 2014)\"","Parlamentarische Initiative","PI","16.3 Majorzwahlen",,"abgeschlossen","Departement für Inneres und Volkswirtschaft"
2024-09-11,"2024/EA 17/62","62","Einfache Anfrage von Ursula Senn-Bieri vom 11. September 2024 \"Selektives Obligatorium Vorschulische Sprachförderung\"","Einfache Anfrage","EA","",,"abgeschlossen","Departement für Erziehung und Kultur"
2024-11-06,"2024/FR 3/63","63","Fragestunde vom 06.11.2024","Fragestunde","FR","10.1 Kantonsverfassung und Staatsverträge",,"abgeschlossen",""
2024-09-30,"2024/BS 4/64","64","Voranschlag 2025 und Finanzplan 2026-2028","Beschluss","BS","61.1 Finanzhaushalt, Finanzverwaltung und -kontrolle","61.2 Budget, Finanzplan, Staatsrechnung","abgeschlossen","Departement für Finanzen und Soziales"
2024-09-30,"2024/EA 18/65","65","Einfache Anfrage von Jürg Wiesli vom 30. September 2024 \"Hohe Kosten einer fast vollzeitlichen Kinderbetreuung\"","Einfache Anfrage","EA","41.0 Unterrichtswesen, Lehrerorganisation und -fortbildung",,"abgeschlossen","Departement für Erziehung und Kultur"
2024-09-30,"2024/EA 19/66","66","Einfache Anfrage von Marion Sontheim vom 30. September 2024 \"Elternbeiträge Klassenlager\"","Einfache Anfrage","EA","41.0 Unterrichtswesen, Lehrerorganisation und -fortbildung",,"abgeschlossen","Departement für Erziehung und Kultur"
2024-09-30,"2024/EA 20/67","67","Einfache Anfrage von Nicole Zeitner, Celina Hug vom 30. September 2024 \"Umsetzung der Sexualstrafrechtsreform im Kanton Thurgau\"","Einfache Anfrage","EA","31.1 StGB, EG/StGB, Verwaltungsstrafrecht",,"abgeschlossen","Departement für Justiz und Sicherheit"
2024-09-30,"2024/EA 21/68","68","Einfache Anfrage von Cornelia Hauser, Nicole Zeitner, Elisabeth Rickenbach vom 30. September 2024 \"Ergänzungsleistungen zur Alters-, Hinterlassenen- und Invalidenversicherung - Tarifanpassung dringend nötig.","Einfache Anfrage","EA","83.1 AHV, IV, EL",,"abgeschlossen","Departement für Finanzen und Soziales"
2024-09-30,"2024/EA 22/69","69","Einfache Anfrage von Stefan Leuthold, Nicole Zeitner, Reto Ammann, Alexander Sigg, Celina Hug, Marcel Preiss vom 30. September 2024 \"Widerrechtliche Adoptionen von indischen Kindern im Thurgau\"","Einfache Anfrage","EA","21.1 ZGB, EG/ZGB, Vormundschaft, Waisenämter",,"abgeschlossen","Departement für Justiz und Sicherheit"
2024-09-30,"2024/BS 5/70","70","Genehmigung des Vorvertrags zum Kaufvertrag zwischen dem Kanton St. Gallen und dem Kanton Thurgau betreffend Erwerb von zwei Liegenschaften durch den Kanton Thurgau und Ermächtigung zur Weiterveräusserung der Parzellen im Rahmen des Gesamtvorhabens WILWEST sowie über die Bewilligung eines Verpflichtungskredits von Fr. 600'000 als Nachtrag zum Budget 2025","Beschluss","BS","70.1 Raumplanung, Richtpläne",,"abgeschlossen","Departement für Bau und Umwelt"
2024-10-23,"2024/PI 2/71","71","Parlamentarische Initiative von Robin Spiri, Barbara Dätwyler Weber, Alexander Sigg, Andreas Sigrist, Judith Ricklin, Patrick Siegenthaler vom 23. Oktober 2024 \"Maximaler steuerlicher Abzug der Krankenkassenprämien der Realität anpassen\"","Parlamentarische Initiative","PI","64.1 Staats- und Gemeindesteuern, allgemeine Organisation",,"abgeschlossen","Departement für Finanzen und Soziales"
2024-10-23,"2024/MO 10/72","72","Motion von Oliver Martin, Marcel Wittwer, Jacob Auer, Didi Feuerle, Sandrine Nikolic-Fuss vom 23. Oktober 2024 \"Abschaffung des regierungsrätlichen Ruhegehalts\"","Motion","MO","",,"pendent","Departement für Finanzen und Soziales"
2024-10-23,"2024/IN 8/73","73","Interpellation von Stefan Leuthold, Cornelia Hasler-Roost, Patrick Siegenthaler vom 23. Oktober 2024 \"Entfremdung: Welche Unterstützung erhalten Betroffene im Thurgau?\"","Interpellation","IN","14.1 Bürgerrecht, Ein- und Ausbürgerungen, Taxen",,"pendent","Departement für Finanzen und Soziales"
2024-10-23,"2024/EA 23/74","74","Einfache Anfrage von Ueli Keller vom 23. Oktober 2024 \"Kinder in der Nothilfe\"","Einfache Anfrage","EA","14.1 Bürgerrecht, Ein- und Ausbürgerungen, Taxen",,"abgeschlossen","Departement für Justiz und Sicherheit"
2024-10-23,"2024/EA 24/75","75","Einfache Anfrage von Robin Spiri vom 23. Oktober 2024 \"Bargeldlose Automaten auf Kantonsgebiet\"","Einfache Anfrage","EA","13.1 Gebiet, Organisation, Reglemente, Verwaltung",,"abgeschlossen","Departement für Finanzen und Soziales"
2024-12-18,"2024/FR 4/76","76","Fragestunde vom 18.12.2024","Fragestunde","FR","10.1 Kantonsverfassung und Staatsverträge",,"abgeschlossen","Grosser Rat"
2024-11-06,"2024/EA 25/77","77","Einfache Anfrage von Kenny Greber vom 6. November 2024 \"Areal Hasli / Wigoltingen Innovation Park (WIP)\"","Einfache Anfrage","EA","90.0 Wirtschaftliche Entwicklung",,"abgeschlossen","Departement für Bau und Umwelt"
2024-11-06,"2024/EA 26/78","78","Einfache Anfrage von Robin Spiri vom 6. November 2024 \"Food Waste reduzieren und Wegwerfkultur stoppen\"","Einfache Anfrage","EA","",,"abgeschlossen","Departement für Finanzen und Soziales"
2024-11-06,"2024/EA 27/79","79","Einfache Anfrage von Simon Weilenmann vom 6. November 2024 \"Ist die Beschlagnahmung von Vermögenswerten von geflüchteten Personen im Zusammenhang mit der Sonderabgabe, Asylgesetz Art. 86, in den Thurgauer Gemeinden zulässig?","Einfache Anfrage","EA","",,"abgeschlossen","Departement für Finanzen und Soziales"
2024-11-06,"2024/EA 28/80","80","Einfache Anfrage von Stefan Leuthold, Nicole Zeitner, Reto Ammann, Celina Hug, Marcel Preiss vom 6. November 2024 \"AXPO: Ein ausser Kontrolle geratenes Hochrisiko-Unternehmen?\"","Einfache Anfrage","EA","",,"abgeschlossen","Departement für Inneres und Volkswirtschaft"
2024-11-06,"2024/EA 29/81","81","Einfache Anfrage von Simon Weilenmann vom 6. November 2024 \"Pestizide im Trinkwasser\"","Einfache Anfrage","EA","",,"abgeschlossen","Departement für Finanzen und Soziales"
2024-11-06,"2024/EA 30/82","82","Einfache Anfrage von Aline Indergand vom 6. November 2024 \"Willkommenskultur im Migrationsamt\"","Einfache Anfrage","EA","",,"abgeschlossen","Departement für Justiz und Sicherheit"
2024-11-06,"2024/EA 31/83","83","Einfache Anfrage von Raphael Stutz vom 6. November 2024 \"Wil West\"","Einfache Anfrage","EA","",,"abgeschlossen","Departement für Bau und Umwelt"
2024-11-06,"2024/EA 32/84","84","Einfache Anfrage von Andreas Wirth vom 6. November 2024 \"Selektives Sprachobligatorium - richtig selektioniert?\"","Einfache Anfrage","EA","41.0 Unterrichtswesen, Lehrerorganisation und -fortbildung",,"abgeschlossen","Departement für Erziehung und Kultur"
2024-11-06,"2024/IN 9/85","85","Interpellation von Stephanie Eberle vom 6. November 2024 \"Integrative Sonderschule oder Separative Integration?\"","Interpellation","IN","",,"pendent","Departement für Erziehung und Kultur"
2024-11-06,"2024/IN 10/86","86","Interpellation von Aline Indergand, Stephanie Eberle vom 6. November 2024 \"Effektive Rückführung von straffälligen Asylmigrantinnen und -migranten\"","Interpellation","IN","",,"pendent","Departement für Justiz und Sicherheit"
2024-11-20,"2024/EA 33/87","87","Einfache Anfrage von Markus Brüllmann, Marion Sontheim vom 20. November 2024 \"Vorgehen betreffend Schutzsuchenden mit Status S, welche eine Lehre antreten oder abschliessen möchten\"","Einfache Anfrage","EA","",,"abgeschlossen","Departement für Finanzen und Soziales"
2024-11-20,"2024/EA 34/88","88","Einfache Anfrage von Edith Wohlfender-Oertig, Kenny Greber, Traudi Schönegger vom 20. November 2024 \"Prävention bei Jugendlichen - eine neue Herausforderung für den Thurgau?\"","Einfache Anfrage","EA","81.0 Allgemeines, Organisation, Gesetz, Taxen",,"abgeschlossen","Departement für Finanzen und Soziales"
2024-11-20,"2024/EA 35/89","89","Einfache Anfrage von Isabelle Vonlanthen-Specker, Didi Feuerle vom 20. November 2024 \"Handel mit Haus- und Wildtieren\"","Einfache Anfrage","EA","91.8 Tierseuchen und -krankheiten, Viehhandel",,"abgeschlossen","Departement für Inneres und Volkswirtschaft"
2024-11-20,"2024/EA 36/90","90","Einfache Anfrage von Christian Caviezel vom 20. November 2024 \"Solares Geoengineering im Thurgauer Flugraum?\"","Einfache Anfrage","EA","",,"abgeschlossen","Departement für Bau und Umwelt"
2024-11-20,"2024/IN 11/91","91","Interpellation von Edith Wohlfender-Oertig, Elina Müller vom 20. November 2024 \"Ermordet, weil sie Frauen sind! Im Thurgau - ein politisches Thema?\"","Interpellation","IN","",,"pendent","Departement für Justiz und Sicherheit"
2024-12-04,"2024/MO 11/92","92","Motion gemäss § 75 der Geschäftsordnung des Grossen Rates (GOGR) von Daniel Eugster, Gabriel Macedo vom 4. Dezember 2024 \"Transparenz der Kosten parlamentarischer Vorstösse\"","Motion","MO","",,"pendent","Staatskanzlei"
2024-12-18,"2024/GE 4/93","93","Änderung des Krankenversicherungsgesetzes (TG KVG)","Gesetz","GE","",,"abgeschlossen","Departement für Finanzen und Soziales"
2024-12-18,"2024/EA 37/94","94","Einfache Anfrage von Stefan Leuthold, Marcel Preiss vom 18. Dezember 2024 \"Thurgauer Klima– und Energieziele: Echte Ambition oder Makulatur?\"","Einfache Anfrage","EA","73.1 Allgemeines, Energiegesetz, Kernenergie, Strahlenschutz",,"abgeschlossen","Departement für Inneres und Volkswirtschaft"
2024-12-18,"2024/EA 38/95","95","Einfache Anfrage von Karin Bétrisey vom 18. Dezember 2024 \"Das Projekt BTS/OLS ist Geschichte – nun soll die Mobilität in unserem Kanton endlich nachhaltig geplant werden\"","Einfache Anfrage","EA","74.1 Strassenverkehr, öffentlicher Verkehr auf Strassen",,"abgeschlossen","Departement für Bau und Umwelt"
2024-12-18,"2024/NA 1/96","96","Standesinitiative von Beat Stump, Oliver Martin, Peter Schenk, Hermann Lei, Stephanie Eberle, Franz Eugster vom 18. Dezember 2024 \"Standesinitiative für Ständemehr. Aus Respekt vor der Bundesverfassung und dem demokratischen Zusammenhalt in der Schweiz.\"","Standesinitiative",,"17.1 Grosser Rat","10.0 Bundesverfassung / Menschenrechte","pendent","Staatskanzlei"
